"No.","Time","Source","Destination","Protocol","Length","Info"
"1","0.000000","104.152.52.23","147.32.83.245","TCP","60","45078  >  5243 [SYN] Seq=0 Win=1024 Len=0"
"2","0.000894","147.32.83.245","104.152.52.23","TCP","54","5243  >  45078 [RST, ACK] Seq=1 Ack=1 Win=0 Len=0"
"3","1.431688","147.32.83.245","104.244.42.194","TLSv1.2","112","Application Data"
"4","1.439113","104.244.42.194","147.32.83.245","TLSv1.2","112","Application Data"
"5","1.440108","147.32.83.245","104.244.42.194","TCP","66","60640  >  443 [ACK] Seq=47 Ack=47 Win=1641 Len=0 TSval=4294959160 TSecr=199124011"
"6","2.774050","147.32.83.245","209.237.199.128","TLSv1.2","112","Application Data"
"7","2.782539","209.237.199.128","147.32.83.245","TLSv1.2","112","Application Data"
"8","2.784027","147.32.83.245","209.237.199.128","TCP","66","42290  >  443 [ACK] Seq=47 Ack=47 Win=1641 Len=0 TSval=4294959496 TSecr=1333752170"
"9","4.991172","60.244.146.157","147.32.83.245","TCP","60","19856  >  80 [SYN] Seq=0 Win=29352 Len=0 MSS=1460"
"10","4.992043","147.32.83.245","60.244.146.157","TCP","54","80  >  19856 [RST, ACK] Seq=1 Ack=1 Win=0 Len=0"
"11","19.496325","104.152.52.23","147.32.83.245","TCP","60","45078  >  514 [SYN] Seq=0 Win=1024 Len=0"
"12","19.497501","147.32.83.245","104.152.52.23","TCP","54","514  >  45078 [RST, ACK] Seq=1 Ack=1 Win=0 Len=0"
"13","19.619449","104.152.52.23","147.32.83.245","TCP","60","45078  >  1494 [SYN] Seq=0 Win=1024 Len=0"
"14","19.620544","147.32.83.245","104.152.52.23","TCP","54","1494  >  45078 [RST, ACK] Seq=1 Ack=1 Win=0 Len=0"
"15","21.429988","207.244.248.194","147.32.83.245","TCP","60","40813  >  8291 [SYN] Seq=0 Win=1024 Len=0"
"16","21.431069","147.32.83.245","207.244.248.194","TCP","54","8291  >  40813 [RST, ACK] Seq=1 Ack=1 Win=0 Len=0"
"17","21.473972","147.32.83.245","104.244.42.194","TLSv1.2","112","Application Data"
"18","21.482087","104.244.42.194","147.32.83.245","TLSv1.2","112","Application Data"
"19","21.482523","147.32.83.245","104.244.42.194","TCP","66","60640  >  443 [ACK] Seq=93 Ack=93 Win=1641 Len=0 TSval=4294964170 TSecr=199144053"
"20","22.816727","147.32.83.245","209.237.199.128","TLSv1.2","112","Application Data"
"21","22.825254","209.237.199.128","147.32.83.245","TLSv1.2","112","Application Data"
"22","22.825824","147.32.83.245","209.237.199.128","TCP","66","42290  >  443 [ACK] Seq=93 Ack=93 Win=1641 Len=0 TSval=4294964506 TSecr=1333772213"
"23","22.829265","172.217.23.206","147.32.83.245","TCP","66","443  >  60742 [FIN, ACK] Seq=1 Ack=1 Win=283 Len=0 TSval=3736936819 TSecr=4294904517"
"24","22.869295","147.32.83.245","172.217.23.206","TCP","66","60742  >  443 [ACK] Seq=1 Ack=2 Win=1728 Len=0 TSval=4294964517 TSecr=3736936819"
"25","33.450853","104.152.52.23","147.32.83.245","TCP","60","45078  >  17500 [SYN] Seq=0 Win=1024 Len=0"
"26","33.451566","147.32.83.245","104.152.52.23","TCP","54","17500  >  45078 [RST, ACK] Seq=1 Ack=1 Win=0 Len=0"
"27","40.235801","104.152.52.23","147.32.83.245","TCP","60","45078  >  2222 [SYN] Seq=0 Win=1024 Len=0"
"28","40.236954","147.32.83.245","104.152.52.23","TCP","54","2222  >  45078 [RST, ACK] Seq=1 Ack=1 Win=0 Len=0"
"29","41.516497","147.32.83.245","104.244.42.194","TLSv1.2","112","Application Data"
"30","41.524057","104.244.42.194","147.32.83.245","TLSv1.2","112","Application Data"
"31","41.525158","147.32.83.245","104.244.42.194","TCP","66","60640  >  443 [ACK] Seq=139 Ack=139 Win=1641 Len=0 TSval=1885 TSecr=199164094"
"32","42.857764","147.32.83.245","209.237.199.128","TLSv1.2","112","Application Data"
"33","42.865833","209.237.199.128","147.32.83.245","TLSv1.2","112","Application Data"
"34","42.866203","147.32.83.245","209.237.199.128","TCP","66","42290  >  443 [ACK] Seq=139 Ack=139 Win=1641 Len=0 TSval=2220 TSecr=1333792253"
"35","49.785901","147.32.83.245","224.0.0.251","MDNS","74","Standard query 0x0000 PTR _fb._tcp.local, ""QM"" question"
"36","49.785906","147.32.83.245","224.0.0.251","MDNS","74","Standard query 0x0000 PTR _fb._tcp.local, ""QM"" question"
"37","50.789019","147.32.83.245","224.0.0.251","MDNS","74","Standard query 0x0000 PTR _fb._tcp.local, ""QM"" question"
"38","50.789022","147.32.83.245","224.0.0.251","MDNS","74","Standard query 0x0000 PTR _fb._tcp.local, ""QM"" question"
"39","53.801306","147.32.83.245","224.0.0.251","MDNS","74","Standard query 0x0000 PTR _fb._tcp.local, ""QM"" question"
"40","53.801315","147.32.83.245","224.0.0.251","MDNS","74","Standard query 0x0000 PTR _fb._tcp.local, ""QM"" question"
"41","53.891290","88.230.45.228","147.32.83.245","TCP","66","31435  >  445 [SYN] Seq=0 Win=8192 Len=0 MSS=1452 WS=4 SACK_PERM=1"
"42","53.894480","147.32.83.245","88.230.45.228","TCP","54","445  >  31435 [RST, ACK] Seq=1 Ack=1 Win=0 Len=0"
"43","54.472092","88.230.45.228","147.32.83.245","TCP","66","[TCP Retransmission] [TCP Port numbers reused] 31435  >  445 [SYN] Seq=0 Win=8192 Len=0 MSS=1452 WS=4 SACK_PERM=1"
"44","54.472874","147.32.83.245","88.230.45.228","TCP","54","445  >  31435 [RST, ACK] Seq=1 Ack=1 Win=0 Len=0"
"45","55.058177","88.230.45.228","147.32.83.245","TCP","62","[TCP Retransmission] [TCP Port numbers reused] 31435  >  445 [SYN] Seq=0 Win=8192 Len=0 MSS=1452 SACK_PERM=1"
"46","55.058450","147.32.83.245","88.230.45.228","TCP","54","445  >  31435 [RST, ACK] Seq=1 Ack=1 Win=0 Len=0"
"47","56.473563","JuniperN_0c:3c:60","Broadcast","ARP","60","Who has 147.32.83.245? Tell 147.32.83.1"
"48","56.474619","PcsCompu_c7:40:4d","JuniperN_0c:3c:60","ARP","42","147.32.83.245 is at 08:00:27:c7:40:4d"
"49","60.909313","89.248.168.62","147.32.83.245","TCP","60","41790  >  9430 [SYN] Seq=0 Win=1024 Len=0"
"50","60.909802","147.32.83.245","89.248.168.62","TCP","54","9430  >  41790 [RST, ACK] Seq=1 Ack=1 Win=0 Len=0"
"51","61.557285","147.32.83.245","104.244.42.194","TLSv1.2","112","Application Data"
"52","61.565173","104.244.42.194","147.32.83.245","TLSv1.2","112","Application Data"
"53","61.568449","147.32.83.245","104.244.42.194","TCP","66","60640  >  443 [ACK] Seq=185 Ack=185 Win=1641 Len=0 TSval=6895 TSecr=199184134"
"54","62.825791","147.32.83.245","224.0.0.251","MDNS","74","Standard query 0x0000 PTR _fb._tcp.local, ""QM"" question"
"55","62.825800","147.32.83.245","224.0.0.251","MDNS","74","Standard query 0x0000 PTR _fb._tcp.local, ""QM"" question"
"56","62.905992","147.32.83.245","209.237.199.128","TLSv1.2","112","Application Data"
"57","62.914034","209.237.199.128","147.32.83.245","TLSv1.2","112","Application Data"
"58","62.914281","147.32.83.245","209.237.199.128","TCP","66","42290  >  443 [ACK] Seq=185 Ack=185 Win=1641 Len=0 TSval=7232 TSecr=1333812302"
"59","72.336439","189.254.235.156","147.32.83.245","TCP","62","63725  >  445 [SYN] Seq=0 Win=8192 Len=0 MSS=1380 SACK_PERM=1"
"60","72.337150","147.32.83.245","189.254.235.156","TCP","54","445  >  63725 [RST, ACK] Seq=1 Ack=1 Win=0 Len=0"
"61","73.014879","189.254.235.156","147.32.83.245","TCP","62","[TCP Port numbers reused] 63725  >  445 [SYN] Seq=0 Win=8192 Len=0 MSS=1380 SACK_PERM=1"
"62","73.015364","147.32.83.245","189.254.235.156","TCP","54","445  >  63725 [RST, ACK] Seq=1 Ack=1 Win=0 Len=0"
"63","81.599654","147.32.83.245","104.244.42.194","TLSv1.2","112","Application Data"
"64","81.608450","104.244.42.194","147.32.83.245","TLSv1.2","112","Application Data"
"65","81.608753","147.32.83.245","104.244.42.194","TCP","66","60640  >  443 [ACK] Seq=231 Ack=231 Win=1641 Len=0 TSval=11905 TSecr=199204177"
"66","82.839491","147.32.83.245","172.217.23.206","TLSv1.2","97","Encrypted Alert"
"67","82.840165","172.217.23.206","147.32.83.245","TCP","60","443  >  60742 [RST] Seq=2 Win=0 Len=0"
"68","82.840550","147.32.83.245","172.217.23.206","TCP","66","60742  >  443 [FIN, ACK] Seq=32 Ack=2 Win=1728 Len=0 TSval=12213 TSecr=3736936819"
"69","82.949968","147.32.83.245","209.237.199.128","TLSv1.2","112","Application Data"
"70","82.958029","209.237.199.128","147.32.83.245","TLSv1.2","112","Application Data"
"71","82.958543","147.32.83.245","209.237.199.128","TCP","66","42290  >  443 [ACK] Seq=231 Ack=231 Win=1641 Len=0 TSval=12243 TSecr=1333832346"
"72","88.771059","45.129.33.182","147.32.83.245","TCP","60","57240  >  41025 [SYN] Seq=0 Win=1024 Len=0"
"73","88.771593","147.32.83.245","45.129.33.182","TCP","54","41025  >  57240 [RST, ACK] Seq=1 Ack=1 Win=0 Len=0"
"74","101.642296","147.32.83.245","104.244.42.194","TLSv1.2","112","Application Data"
"75","101.649810","104.244.42.194","147.32.83.245","TLSv1.2","112","Application Data"
"76","101.650799","147.32.83.245","104.244.42.194","TCP","66","60640  >  443 [ACK] Seq=277 Ack=277 Win=1641 Len=0 TSval=16916 TSecr=199224217"
"77","102.989949","147.32.83.245","209.237.199.128","TLSv1.2","112","Application Data"
"78","102.998095","209.237.199.128","147.32.83.245","TLSv1.2","112","Application Data"
"79","102.999057","147.32.83.245","209.237.199.128","TCP","66","42290  >  443 [ACK] Seq=277 Ack=277 Win=1641 Len=0 TSval=17253 TSecr=1333852386"
"80","109.824247","109.166.70.172","147.32.83.245","TCP","60","43765  >  1433 [SYN] Seq=0 Win=1024 Len=0"
"81","109.825064","147.32.83.245","109.166.70.172","TCP","54","1433  >  43765 [RST, ACK] Seq=1 Ack=1 Win=0 Len=0"
"82","111.221903","104.152.52.23","147.32.83.245","TCP","60","45078  >  9200 [SYN] Seq=0 Win=1024 Len=0"
"83","111.223110","147.32.83.245","104.152.52.23","TCP","54","9200  >  45078 [RST, ACK] Seq=1 Ack=1 Win=0 Len=0"
"84","117.301252","45.129.33.178","147.32.83.245","TCP","60","57114  >  40650 [SYN] Seq=0 Win=1024 Len=0"
"85","117.301850","147.32.83.245","45.129.33.178","TCP","54","40650  >  57114 [RST, ACK] Seq=1 Ack=1 Win=0 Len=0"
"86","117.447712","147.32.83.245","172.217.23.206","TLSv1.2","927","Application Data"
"87","117.452457","172.217.23.206","147.32.83.245","TCP","66","443  >  60762 [ACK] Seq=1 Ack=862 Win=274 Len=0 TSval=420736255 TSecr=20865"
"88","117.469993","172.217.23.206","147.32.83.245","TLSv1.2","656","Application Data"
"89","117.470004","172.217.23.206","147.32.83.245","TLSv1.2","356","Application Data"
"90","117.470055","172.217.23.206","147.32.83.245","TLSv1.2","93","Application Data"
"91","117.472318","147.32.83.245","172.217.23.206","TCP","66","60762  >  443 [ACK] Seq=862 Ack=908 Win=1681 Len=0 TSval=20871 TSecr=420736272"
"92","121.684839","147.32.83.245","104.244.42.194","TLSv1.2","112","Application Data"
"93","121.692734","104.244.42.194","147.32.83.245","TLSv1.2","112","Application Data"
"94","121.693825","147.32.83.245","104.244.42.194","TCP","66","60640  >  443 [ACK] Seq=323 Ack=323 Win=1641 Len=0 TSval=21926 TSecr=199244259"
"95","123.008255","147.32.83.245","209.237.199.128","TLSv1.2","112","Application Data"
"96","123.016677","209.237.199.128","147.32.83.245","TLSv1.2","112","Application Data"
"97","123.017416","147.32.83.245","209.237.199.128","TCP","66","42290  >  443 [ACK] Seq=323 Ack=323 Win=1641 Len=0 TSval=22257 TSecr=1333872404"
"98","141.711921","147.32.83.245","104.244.42.194","TLSv1.2","112","Application Data"
"99","141.719356","104.244.42.194","147.32.83.245","TLSv1.2","112","Application Data"
"100","141.720097","147.32.83.245","104.244.42.194","TCP","66","60640  >  443 [ACK] Seq=369 Ack=369 Win=1641 Len=0 TSval=26933 TSecr=199264285"
"101","143.050428","147.32.83.245","209.237.199.128","TLSv1.2","112","Application Data"
"102","143.058567","209.237.199.128","147.32.83.245","TLSv1.2","112","Application Data"
"103","143.059492","147.32.83.245","209.237.199.128","TCP","66","42290  >  443 [ACK] Seq=369 Ack=369 Win=1641 Len=0 TSval=27268 TSecr=1333892446"
"104","146.251842","104.152.52.23","147.32.83.245","UDP","60","45078  >  3456 Len=0"
"105","146.252213","147.32.83.245","104.152.52.23","ICMP","70","Destination unreachable (Port unreachable)"
"106","147.917137","104.152.52.23","147.32.83.245","TCP","60","45078  >  9418 [SYN] Seq=0 Win=1024 Len=0"
"107","147.917966","147.32.83.245","104.152.52.23","TCP","54","9418  >  45078 [RST, ACK] Seq=1 Ack=1 Win=0 Len=0"
"108","148.769498","104.152.52.23","147.32.83.245","UDP","60","45078  >  158 Len=0"
"109","148.770470","147.32.83.245","104.152.52.23","ICMP","70","Destination unreachable (Port unreachable)"
"110","149.454093","147.32.83.245","209.237.199.128","TLSv1.2","442","Application Data"
"111","149.502181","209.237.199.128","147.32.83.245","TCP","66","443  >  42290 [ACK] Seq=369 Ack=745 Win=153 Len=0 TSval=1333898890 TSecr=28866"
"112","149.653559","209.237.199.128","147.32.83.245","TLSv1.2","403","Application Data, Application Data"
"113","149.655732","147.32.83.245","209.237.199.128","TCP","66","42290  >  443 [ACK] Seq=745 Ack=706 Win=1686 Len=0 TSval=28916 TSecr=1333899041"
"114","149.811035","147.32.83.245","209.237.199.128","TLSv1.2","504","Application Data"
"115","149.819019","209.237.199.128","147.32.83.245","TCP","66","443  >  42290 [ACK] Seq=706 Ack=1183 Win=164 Len=0 TSval=1333899207 TSecr=28956"
"116","149.966294","209.237.199.128","147.32.83.245","TLSv1.2","1155","Application Data, Application Data"
"117","149.967051","147.32.83.245","209.237.199.128","TCP","66","42290  >  443 [ACK] Seq=1183 Ack=1795 Win=1731 Len=0 TSval=28994 TSecr=1333899354"
"118","149.976583","147.32.83.245","104.244.42.194","TLSv1.2","135","Application Data"
"119","150.024373","104.244.42.194","147.32.83.245","TCP","66","443  >  60640 [ACK] Seq=369 Ack=438 Win=306 Len=0 TSval=199272590 TSecr=28997"
"120","150.044824","147.32.83.245","209.237.199.128","TLSv1.2","121","Application Data"
"121","150.052748","209.237.199.128","147.32.83.245","TCP","66","443  >  42290 [ACK] Seq=1795 Ack=1238 Win=164 Len=0 TSval=1333899440 TSecr=29014"
"122","150.089076","104.244.42.194","147.32.83.245","TLSv1.2","339","Application Data, Application Data"
"123","150.090004","147.32.83.245","104.244.42.194","TCP","66","60640  >  443 [ACK] Seq=438 Ack=642 Win=1686 Len=0 TSval=29025 TSecr=199272655"
"124","150.165631","209.237.199.128","147.32.83.245","TLSv1.2","231","Application Data, Application Data"
"125","150.166080","147.32.83.245","209.237.199.128","TCP","66","42290  >  443 [ACK] Seq=1238 Ack=1960 Win=1776 Len=0 TSval=29044 TSecr=1333899553"
"126","150.211128","147.32.83.245","209.237.199.128","TLSv1.2","601","Application Data"
"127","150.219072","209.237.199.128","147.32.83.245","TCP","66","443  >  42290 [ACK] Seq=1960 Ack=1773 Win=176 Len=0 TSval=1333899607 TSecr=29056"
"128","150.345526","209.237.199.128","147.32.83.245","TLSv1.2","801","Application Data, Application Data"
"129","150.350769","147.32.83.245","209.237.199.128","TCP","66","42290  >  443 [ACK] Seq=1773 Ack=2695 Win=1822 Len=0 TSval=29090 TSecr=1333899733"
"130","150.547957","147.32.83.245","209.237.199.128","TLSv1.2","454","Application Data"
"131","150.555984","209.237.199.128","147.32.83.245","TCP","66","443  >  42290 [ACK] Seq=2695 Ack=2161 Win=187 Len=0 TSval=1333899944 TSecr=29139"
"132","150.690170","209.237.199.128","147.32.83.245","TLSv1.2","328","Application Data, Application Data"
"133","150.691547","147.32.83.245","209.237.199.128","TCP","66","42290  >  443 [ACK] Seq=2161 Ack=2957 Win=1867 Len=0 TSval=29176 TSecr=1333900078"
"134","150.978092","147.32.83.245","209.237.199.128","TLSv1.2","854","Application Data"
"135","150.986087","209.237.199.128","147.32.83.245","TCP","66","443  >  42290 [ACK] Seq=2957 Ack=2949 Win=198 Len=0 TSval=1333900374 TSecr=29247"
"136","150.986350","147.32.83.245","209.237.199.128","TLSv1.2","104","Application Data"
"137","150.994259","209.237.199.128","147.32.83.245","TCP","66","443  >  42290 [ACK] Seq=2957 Ack=2987 Win=198 Len=0 TSval=1333900382 TSecr=29249"
"138","151.116288","209.237.199.128","147.32.83.245","TLSv1.2","192","Application Data, Application Data"
"139","151.116824","147.32.83.245","209.237.199.128","TCP","66","42290  >  443 [ACK] Seq=2987 Ack=3083 Win=1867 Len=0 TSval=29282 TSecr=1333900504"
"140","151.584229","147.32.83.245","104.244.42.194","TLSv1.2","498","Application Data"
"141","151.591712","104.244.42.194","147.32.83.245","TCP","66","443  >  60640 [ACK] Seq=642 Ack=870 Win=317 Len=0 TSval=199274157 TSecr=29399"
"142","151.593939","147.32.83.245","104.244.42.194","TLSv1.2","359","Application Data"
"143","151.601275","104.244.42.194","147.32.83.245","TCP","66","443  >  60640 [ACK] Seq=642 Ack=1163 Win=328 Len=0 TSval=199274167 TSecr=29401"
"144","151.717259","104.244.42.194","147.32.83.245","TLSv1.2","261","Application Data, Application Data"
"145","151.718060","147.32.83.245","104.244.42.194","TCP","66","60640  >  443 [ACK] Seq=1163 Ack=837 Win=1731 Len=0 TSval=29432 TSecr=199274283"
"146","151.739071","104.244.42.194","147.32.83.245","TLSv1.2","1477","Application Data, Application Data"
"147","151.740659","147.32.83.245","104.244.42.194","TCP","66","60640  >  443 [ACK] Seq=1163 Ack=2248 Win=1776 Len=0 TSval=29438 TSecr=199274305"
"148","151.917515","147.32.83.245","209.237.199.128","TLSv1.2","782","Application Data"
"149","151.925593","209.237.199.128","147.32.83.245","TCP","66","443  >  42290 [ACK] Seq=3083 Ack=3703 Win=210 Len=0 TSval=1333901313 TSecr=29482"
"150","151.965778","147.32.83.245","209.237.199.128","TLSv1.2","464","Application Data"
"151","151.973718","209.237.199.128","147.32.83.245","TCP","66","443  >  42290 [ACK] Seq=3083 Ack=4101 Win=221 Len=0 TSval=1333901361 TSecr=29494"
"152","152.039893","209.237.199.128","147.32.83.245","TLSv1.2","299","Application Data, Application Data"
"153","152.044056","147.32.83.245","209.237.199.128","TCP","66","42290  >  443 [ACK] Seq=4101 Ack=3316 Win=1912 Len=0 TSval=29514 TSecr=1333901427"
"154","152.107660","147.32.83.245","104.244.42.194","TLSv1.2","255","Application Data"
"155","152.115003","104.244.42.194","147.32.83.245","TCP","66","443  >  60640 [ACK] Seq=2248 Ack=1352 Win=340 Len=0 TSval=199274681 TSecr=29530"
"156","152.209609","209.237.199.128","147.32.83.245","TLSv1.2","384","Application Data, Application Data"
"157","152.212028","147.32.83.245","209.237.199.128","TCP","66","42290  >  443 [ACK] Seq=4101 Ack=3634 Win=1957 Len=0 TSval=29556 TSecr=1333901597"
"158","152.251099","104.244.42.194","147.32.83.245","TLSv1.2","1192","Application Data, Application Data"
"159","152.251391","147.32.83.245","104.244.42.194","TCP","66","60640  >  443 [ACK] Seq=1352 Ack=3374 Win=1822 Len=0 TSval=29566 TSecr=199274817"
"160","153.507622","147.32.83.245","104.244.42.3","TCP","74","56804  >  443 [SYN] Seq=0 Win=65535 Len=0 MSS=1460 SACK_PERM=1 TSval=29880 TSecr=0 WS=64"
"161","153.514997","104.244.42.3","147.32.83.245","TCP","74","443  >  56804 [SYN, ACK] Seq=0 Ack=1 Win=28960 Len=0 MSS=1460 SACK_PERM=1 TSval=3204969720 TSecr=29880 WS=256"
"162","153.516286","147.32.83.245","104.244.42.3","TCP","66","56804  >  443 [ACK] Seq=1 Ack=1 Win=87616 Len=0 TSval=29882 TSecr=3204969720"
"163","153.520451","147.32.83.245","104.244.42.3","TLSv1.2","583","Client Hello"
"164","153.527773","104.244.42.3","147.32.83.245","TCP","66","443  >  56804 [ACK] Seq=1 Ack=518 Win=30208 Len=0 TSval=3204969732 TSecr=29882"
"165","153.529947","104.244.42.3","147.32.83.245","TLSv1.2","3363","Server Hello, Certificate, Server Key Exchange, Server Hello Done"
"166","153.530385","147.32.83.245","104.244.42.3","TCP","66","56804  >  443 [ACK] Seq=518 Ack=1449 Win=90496 Len=0 TSval=29885 TSecr=3204969735"
"167","153.530448","147.32.83.245","104.244.42.3","TCP","66","56804  >  443 [ACK] Seq=518 Ack=2897 Win=93440 Len=0 TSval=29885 TSecr=3204969735"
"168","153.530546","147.32.83.245","104.244.42.3","TCP","66","56804  >  443 [ACK] Seq=518 Ack=3298 Win=96320 Len=0 TSval=29885 TSecr=3204969735"
"169","153.607968","147.32.83.245","104.244.42.3","TLSv1.2","192","Client Key Exchange, Change Cipher Spec, Encrypted Handshake Message"
"170","153.613863","147.32.83.245","209.237.199.128","TLSv1.2","911","Application Data"
"171","153.615613","104.244.42.3","147.32.83.245","TLSv1.2","308","New Session Ticket, Change Cipher Spec, Encrypted Handshake Message"
"172","153.615631","104.244.42.3","147.32.83.245","TLSv1.2","110","Application Data"
"173","153.616012","147.32.83.245","104.244.42.3","TLSv1.2","205","Application Data, Application Data, Application Data"
"174","153.622023","209.237.199.128","147.32.83.245","TCP","66","443  >  42290 [ACK] Seq=3634 Ack=4946 Win=232 Len=0 TSval=1333903010 TSecr=29906"
"175","153.622350","147.32.83.245","209.237.199.128","TLSv1.2","104","Application Data"
"176","153.623304","104.244.42.3","147.32.83.245","TLSv1.2","104","Application Data"
"177","153.623689","147.32.83.245","104.244.42.3","TCP","66","56804  >  443 [ACK] Seq=783 Ack=3622 Win=99200 Len=0 TSval=29909 TSecr=3204969820"
"178","153.630321","209.237.199.128","147.32.83.245","TCP","66","443  >  42290 [ACK] Seq=3634 Ack=4984 Win=232 Len=0 TSval=1333903018 TSecr=29908"
"179","153.635495","147.32.83.245","104.244.42.3","TLSv1.2","1039","Application Data"
"180","153.684234","104.244.42.3","147.32.83.245","TCP","66","443  >  56804 [ACK] Seq=3622 Ack=1756 Win=33280 Len=0 TSval=3204969889 TSecr=29911"
"181","153.684944","147.32.83.245","104.244.42.3","TLSv1.2","104","Application Data"
"182","153.692242","104.244.42.3","147.32.83.245","TCP","66","443  >  56804 [ACK] Seq=3622 Ack=1794 Win=33280 Len=0 TSval=3204969897 TSecr=29924"
"183","153.766328","104.244.42.3","147.32.83.245","TLSv1.2","489","Application Data"
"184","153.766360","104.244.42.3","147.32.83.245","TLSv1.2","251","Application Data"
"185","153.766421","104.244.42.3","147.32.83.245","TLSv1.2","134","Application Data"
"186","153.770288","147.32.83.245","104.244.42.3","TCP","66","56804  >  443 [ACK] Seq=1794 Ack=4298 Win=105024 Len=0 TSval=29945 TSecr=3204969971"
"187","153.819681","147.32.83.245","104.244.42.3","TLSv1.2","880","Application Data"
"188","153.827100","104.244.42.3","147.32.83.245","TCP","66","443  >  56804 [ACK] Seq=4298 Ack=2608 Win=35072 Len=0 TSval=3204970032 TSecr=29957"
"189","153.827752","147.32.83.245","104.244.42.3","TLSv1.2","104","Application Data"
"190","153.835101","104.244.42.3","147.32.83.245","TCP","66","443  >  56804 [ACK] Seq=4298 Ack=2646 Win=35072 Len=0 TSval=3204970040 TSecr=29960"
"191","153.954886","104.244.42.3","147.32.83.245","TLSv1.2","292","Application Data, Application Data"
"192","153.995011","147.32.83.245","104.244.42.3","TCP","66","56804  >  443 [ACK] Seq=2646 Ack=4524 Win=107904 Len=0 TSval=30002 TSecr=3204970160"
"193","154.600924","209.237.199.128","147.32.83.245","TLSv1.2","5858","Application Data, Application Data"
"194","154.600994","209.237.199.128","147.32.83.245","TCP","1514","443  >  42290 [ACK] Seq=9426 Ack=4984 Win=232 Len=1448 TSval=1333903988 TSecr=29908 [TCP segment of a reassembled PDU]"
"195","154.601002","209.237.199.128","147.32.83.245","TLSv1.2","7306","Application Data, Application Data"
"196","154.602496","147.32.83.245","209.237.199.128","TCP","66","42290  >  443 [ACK] Seq=4984 Ack=5082 Win=2003 Len=0 TSval=30153 TSecr=1333903988"
"197","154.602546","147.32.83.245","209.237.199.128","TCP","66","42290  >  443 [ACK] Seq=4984 Ack=6530 Win=2048 Len=0 TSval=30153 TSecr=1333903988"
"198","154.602572","147.32.83.245","209.237.199.128","TCP","66","42290  >  443 [ACK] Seq=4984 Ack=7978 Win=2093 Len=0 TSval=30153 TSecr=1333903988"
"199","154.602585","147.32.83.245","209.237.199.128","TCP","66","42290  >  443 [ACK] Seq=4984 Ack=9426 Win=2138 Len=0 TSval=30153 TSecr=1333903988"
"200","154.602610","147.32.83.245","209.237.199.128","TCP","78","[TCP Window Update] 42290  >  443 [ACK] Seq=4984 Ack=9426 Win=2184 Len=0 TSval=30153 TSecr=1333903988 SLE=10874 SRE=12322"
"201","154.602625","147.32.83.245","209.237.199.128","TCP","78","[TCP Window Update] 42290  >  443 [ACK] Seq=4984 Ack=9426 Win=2229 Len=0 TSval=30153 TSecr=1333903988 SLE=10874 SRE=13770"
"202","154.602674","147.32.83.245","209.237.199.128","TCP","78","[TCP Window Update] 42290  >  443 [ACK] Seq=4984 Ack=9426 Win=2274 Len=0 TSval=30153 TSecr=1333903988 SLE=10874 SRE=15218"
"203","154.602691","147.32.83.245","209.237.199.128","TCP","78","[TCP Window Update] 42290  >  443 [ACK] Seq=4984 Ack=9426 Win=2319 Len=0 TSval=30153 TSecr=1333903988 SLE=10874 SRE=16666"
"204","154.602702","147.32.83.245","209.237.199.128","TCP","78","[TCP Window Update] 42290  >  443 [ACK] Seq=4984 Ack=9426 Win=2365 Len=0 TSval=30153 TSecr=1333903988 SLE=10874 SRE=18114"
"205","154.602714","147.32.83.245","209.237.199.128","TCP","66","42290  >  443 [ACK] Seq=4984 Ack=18114 Win=2410 Len=0 TSval=30153 TSecr=1333903988"
"206","154.610479","209.237.199.128","147.32.83.245","TLSv1.2","5858","Application Data, Application Data, Application Data"
"207","154.610581","209.237.199.128","147.32.83.245","TLSv1.2","8754","Application Data, Application Data"
"208","154.610655","209.237.199.128","147.32.83.245","TCP","1514","[TCP Spurious Retransmission] 443  >  42290 [ACK] Seq=9426 Ack=4984 Win=232 Len=1448 TSval=1333903998 TSecr=30153"
"209","154.610668","209.237.199.128","147.32.83.245","TLSv1.2","1514","Application Data [TCP segment of a reassembled PDU]"
"210","154.610745","209.237.199.128","147.32.83.245","TLSv1.2","5858","Application Data, Application Data, Application Data"
"211","154.612815","147.32.83.245","209.237.199.128","TCP","66","42290  >  443 [ACK] Seq=4984 Ack=19562 Win=2455 Len=0 TSval=30156 TSecr=1333903998"
"212","154.612849","147.32.83.245","209.237.199.128","TCP","66","42290  >  443 [ACK] Seq=4984 Ack=21010 Win=2500 Len=0 TSval=30156 TSecr=1333903998"
"213","154.612865","147.32.83.245","209.237.199.128","TCP","66","42290  >  443 [ACK] Seq=4984 Ack=22458 Win=2546 Len=0 TSval=30156 TSecr=1333903998"
"214","154.612878","147.32.83.245","209.237.199.128","TCP","66","42290  >  443 [ACK] Seq=4984 Ack=23906 Win=2591 Len=0 TSval=30156 TSecr=1333903998"
"215","154.612890","147.32.83.245","209.237.199.128","TCP","66","42290  >  443 [ACK] Seq=4984 Ack=25354 Win=2636 Len=0 TSval=30156 TSecr=1333903998"
"216","154.612903","147.32.83.245","209.237.199.128","TCP","66","42290  >  443 [ACK] Seq=4984 Ack=26802 Win=2681 Len=0 TSval=30156 TSecr=1333903998"
"217","154.612916","147.32.83.245","209.237.199.128","TCP","66","42290  >  443 [ACK] Seq=4984 Ack=28250 Win=2727 Len=0 TSval=30156 TSecr=1333903998"
"218","154.612931","147.32.83.245","209.237.199.128","TCP","66","42290  >  443 [ACK] Seq=4984 Ack=29698 Win=2772 Len=0 TSval=30156 TSecr=1333903998"
"219","154.612946","147.32.83.245","209.237.199.128","TCP","66","42290  >  443 [ACK] Seq=4984 Ack=31146 Win=2817 Len=0 TSval=30156 TSecr=1333903998"
"220","154.612958","147.32.83.245","209.237.199.128","TCP","66","42290  >  443 [ACK] Seq=4984 Ack=32594 Win=2862 Len=0 TSval=30156 TSecr=1333903998"
"221","154.612970","147.32.83.245","209.237.199.128","TCP","78","[TCP Dup ACK 220#1] 42290  >  443 [ACK] Seq=4984 Ack=32594 Win=2862 Len=0 TSval=30156 TSecr=1333903998 SLE=9426 SRE=10874"
"222","154.612982","147.32.83.245","209.237.199.128","TCP","78","[TCP Window Update] 42290  >  443 [ACK] Seq=4984 Ack=32594 Win=2908 Len=0 TSval=30156 TSecr=1333903998 SLE=34042 SRE=35490"
"223","154.612995","147.32.83.245","209.237.199.128","TCP","78","[TCP Window Update] 42290  >  443 [ACK] Seq=4984 Ack=32594 Win=2953 Len=0 TSval=30156 TSecr=1333903998 SLE=34042 SRE=36938"
"224","154.613007","147.32.83.245","209.237.199.128","TCP","78","[TCP Window Update] 42290  >  443 [ACK] Seq=4984 Ack=32594 Win=2998 Len=0 TSval=30156 TSecr=1333903998 SLE=34042 SRE=38386"
"225","154.613016","147.32.83.245","209.237.199.128","TCP","78","[TCP Window Update] 42290  >  443 [ACK] Seq=4984 Ack=32594 Win=3043 Len=0 TSval=30156 TSecr=1333903998 SLE=34042 SRE=39834"
"226","154.613028","147.32.83.245","209.237.199.128","TCP","66","42290  >  443 [ACK] Seq=4984 Ack=39834 Win=3089 Len=0 TSval=30156 TSecr=1333903998"
"227","154.620829","209.237.199.128","147.32.83.245","TLSv1.2","7306","Application Data, Application Data"
"228","154.620965","209.237.199.128","147.32.83.245","TLSv1.2","14546","Application Data, Application Data, Application Data, Application Data, Application Data"
"229","154.621046","209.237.199.128","147.32.83.245","TLSv1.2","7306","Application Data, Application Data"
"230","154.621057","209.237.199.128","147.32.83.245","TLSv1.2","2962","Application Data, Application Data, Application Data"
"231","154.621306","209.237.199.128","147.32.83.245","TLSv1.2","7582","Application Data, Application Data, Application Data"
"232","154.623653","147.32.83.245","209.237.199.128","TCP","66","42290  >  443 [ACK] Seq=4984 Ack=41282 Win=3134 Len=0 TSval=30158 TSecr=1333904008"
"233","154.623700","147.32.83.245","209.237.199.128","TCP","66","42290  >  443 [ACK] Seq=4984 Ack=42730 Win=3179 Len=0 TSval=30158 TSecr=1333904008"
"234","154.623715","147.32.83.245","209.237.199.128","TCP","66","42290  >  443 [ACK] Seq=4984 Ack=44178 Win=3224 Len=0 TSval=30158 TSecr=1333904008"
"235","154.623729","147.32.83.245","209.237.199.128","TCP","66","42290  >  443 [ACK] Seq=4984 Ack=45626 Win=3270 Len=0 TSval=30159 TSecr=1333904008"
"236","154.623741","147.32.83.245","209.237.199.128","TCP","66","42290  >  443 [ACK] Seq=4984 Ack=47074 Win=3315 Len=0 TSval=30159 TSecr=1333904008"
"237","154.623753","147.32.83.245","209.237.199.128","TCP","66","42290  >  443 [ACK] Seq=4984 Ack=48522 Win=3360 Len=0 TSval=30159 TSecr=1333904008"
"238","154.623763","147.32.83.245","209.237.199.128","TCP","66","42290  >  443 [ACK] Seq=4984 Ack=49970 Win=3405 Len=0 TSval=30159 TSecr=1333904008"
"239","154.623777","147.32.83.245","209.237.199.128","TCP","66","42290  >  443 [ACK] Seq=4984 Ack=51418 Win=3451 Len=0 TSval=30159 TSecr=1333904008"
"240","154.623788","147.32.83.245","209.237.199.128","TCP","66","42290  >  443 [ACK] Seq=4984 Ack=52866 Win=3496 Len=0 TSval=30159 TSecr=1333904008"
"241","154.623800","147.32.83.245","209.237.199.128","TCP","66","42290  >  443 [ACK] Seq=4984 Ack=54314 Win=3541 Len=0 TSval=30159 TSecr=1333904008"
"242","154.623810","147.32.83.245","209.237.199.128","TCP","66","42290  >  443 [ACK] Seq=4984 Ack=55762 Win=3586 Len=0 TSval=30159 TSecr=1333904008"
"243","154.623822","147.32.83.245","209.237.199.128","TCP","66","42290  >  443 [ACK] Seq=4984 Ack=57210 Win=3632 Len=0 TSval=30159 TSecr=1333904008"
"244","154.623835","147.32.83.245","209.237.199.128","TCP","66","42290  >  443 [ACK] Seq=4984 Ack=58658 Win=3677 Len=0 TSval=30159 TSecr=1333904008"
"245","154.623845","147.32.83.245","209.237.199.128","TCP","66","42290  >  443 [ACK] Seq=4984 Ack=60106 Win=3722 Len=0 TSval=30159 TSecr=1333904008"
"246","154.623857","147.32.83.245","209.237.199.128","TCP","66","42290  >  443 [ACK] Seq=4984 Ack=61554 Win=3767 Len=0 TSval=30159 TSecr=1333904008"
"247","154.623866","147.32.83.245","209.237.199.128","TCP","66","42290  >  443 [ACK] Seq=4984 Ack=63002 Win=3813 Len=0 TSval=30159 TSecr=1333904008"
"248","154.623876","147.32.83.245","209.237.199.128","TCP","66","42290  >  443 [ACK] Seq=4984 Ack=64450 Win=3858 Len=0 TSval=30159 TSecr=1333904008"
"249","154.623887","147.32.83.245","209.237.199.128","TCP","66","42290  >  443 [ACK] Seq=4984 Ack=65898 Win=3903 Len=0 TSval=30159 TSecr=1333904008"
"250","154.623915","147.32.83.245","209.237.199.128","TCP","66","42290  >  443 [ACK] Seq=4984 Ack=67346 Win=3948 Len=0 TSval=30159 TSecr=1333904008"
"251","154.623929","147.32.83.245","209.237.199.128","TCP","66","42290  >  443 [ACK] Seq=4984 Ack=68794 Win=3994 Len=0 TSval=30159 TSecr=1333904008"
"252","154.623943","147.32.83.245","209.237.199.128","TCP","66","42290  >  443 [ACK] Seq=4984 Ack=70242 Win=4039 Len=0 TSval=30159 TSecr=1333904009"
"253","154.623951","147.32.83.245","209.237.199.128","TCP","66","42290  >  443 [ACK] Seq=4984 Ack=71690 Win=4084 Len=0 TSval=30159 TSecr=1333904009"
"254","154.623962","147.32.83.245","209.237.199.128","TCP","66","42290  >  443 [ACK] Seq=4984 Ack=73138 Win=4129 Len=0 TSval=30159 TSecr=1333904009"
"255","154.623972","147.32.83.245","209.237.199.128","TCP","66","42290  >  443 [ACK] Seq=4984 Ack=74586 Win=4175 Len=0 TSval=30159 TSecr=1333904009"
"256","154.623982","147.32.83.245","209.237.199.128","TCP","66","42290  >  443 [ACK] Seq=4984 Ack=76034 Win=4220 Len=0 TSval=30159 TSecr=1333904009"
"257","154.623992","147.32.83.245","209.237.199.128","TCP","66","42290  >  443 [ACK] Seq=4984 Ack=77482 Win=4265 Len=0 TSval=30159 TSecr=1333904009"
"258","154.624004","147.32.83.245","209.237.199.128","TCP","66","42290  >  443 [ACK] Seq=4984 Ack=78930 Win=4310 Len=0 TSval=30159 TSecr=1333904009"
"259","154.624014","147.32.83.245","209.237.199.128","TCP","66","42290  >  443 [ACK] Seq=4984 Ack=79206 Win=4310 Len=0 TSval=30159 TSecr=1333904009"
"260","156.349507","147.32.83.245","209.237.199.128","TLSv1.2","451","Application Data"
"261","156.357575","209.237.199.128","147.32.83.245","TCP","66","443  >  42290 [ACK] Seq=79206 Ack=5369 Win=244 Len=0 TSval=1333905745 TSecr=30589"
"262","156.368142","147.32.83.245","209.237.199.128","TLSv1.2","451","Application Data"
"263","156.376028","209.237.199.128","147.32.83.245","TCP","66","443  >  42290 [ACK] Seq=79206 Ack=5754 Win=255 Len=0 TSval=1333905764 TSecr=30595"
"264","156.394428","147.32.83.245","209.237.199.128","TLSv1.2","494","Application Data"
"265","156.402368","209.237.199.128","147.32.83.245","TCP","66","443  >  42290 [ACK] Seq=79206 Ack=6182 Win=266 Len=0 TSval=1333905790 TSecr=30601"
"266","156.444722","147.32.83.245","209.237.199.128","TLSv1.2","1307","Application Data"
"267","156.452686","209.237.199.128","147.32.83.245","TCP","66","443  >  42290 [ACK] Seq=79206 Ack=7423 Win=277 Len=0 TSval=1333905840 TSecr=30614"
"268","156.498960","209.237.199.128","147.32.83.245","TLSv1.2","324","Application Data, Application Data"
"269","156.499780","147.32.83.245","209.237.199.128","TCP","66","42290  >  443 [ACK] Seq=7423 Ack=79464 Win=4310 Len=0 TSval=30628 TSecr=1333905887"
"270","156.509995","209.237.199.128","147.32.83.245","TLSv1.2","7306","Application Data, Application Data"
"271","156.510132","209.237.199.128","147.32.83.245","TLSv1.2","9407","Application Data, Application Data, Application Data, Application Data"
"272","156.510155","209.237.199.128","147.32.83.245","TLSv1.2","5858","Application Data, Application Data"
"273","156.510216","209.237.199.128","147.32.83.245","TLSv1.2","5782","Application Data, Application Data"
"274","156.512573","147.32.83.245","209.237.199.128","TCP","66","42290  >  443 [ACK] Seq=7423 Ack=80912 Win=4356 Len=0 TSval=30630 TSecr=1333905898"
"275","156.512620","147.32.83.245","209.237.199.128","TCP","66","42290  >  443 [ACK] Seq=7423 Ack=82360 Win=4401 Len=0 TSval=30631 TSecr=1333905898"
"276","156.512635","147.32.83.245","209.237.199.128","TCP","66","42290  >  443 [ACK] Seq=7423 Ack=83808 Win=4446 Len=0 TSval=30631 TSecr=1333905898"
"277","156.512648","147.32.83.245","209.237.199.128","TCP","66","42290  >  443 [ACK] Seq=7423 Ack=85256 Win=4491 Len=0 TSval=30631 TSecr=1333905898"
"278","156.512663","147.32.83.245","209.237.199.128","TCP","66","42290  >  443 [ACK] Seq=7423 Ack=86704 Win=4537 Len=0 TSval=30631 TSecr=1333905898"
"279","156.512681","147.32.83.245","209.237.199.128","TCP","66","42290  >  443 [ACK] Seq=7423 Ack=88152 Win=4582 Len=0 TSval=30631 TSecr=1333905898"
"280","156.512693","147.32.83.245","209.237.199.128","TCP","66","42290  >  443 [ACK] Seq=7423 Ack=89600 Win=4627 Len=0 TSval=30631 TSecr=1333905898"
"281","156.512707","147.32.83.245","209.237.199.128","TCP","66","42290  >  443 [ACK] Seq=7423 Ack=91048 Win=4672 Len=0 TSval=30631 TSecr=1333905898"
"282","156.512720","147.32.83.245","209.237.199.128","TCP","66","42290  >  443 [ACK] Seq=7423 Ack=92496 Win=4718 Len=0 TSval=30631 TSecr=1333905898"
"283","156.512737","147.32.83.245","209.237.199.128","TCP","66","42290  >  443 [ACK] Seq=7423 Ack=93944 Win=4763 Len=0 TSval=30631 TSecr=1333905898"
"284","156.512749","147.32.83.245","209.237.199.128","TCP","66","42290  >  443 [ACK] Seq=7423 Ack=95392 Win=4808 Len=0 TSval=30631 TSecr=1333905898"
"285","156.512759","147.32.83.245","209.237.199.128","TCP","66","42290  >  443 [ACK] Seq=7423 Ack=96045 Win=4853 Len=0 TSval=30631 TSecr=1333905898"
"286","156.512770","147.32.83.245","209.237.199.128","TCP","66","42290  >  443 [ACK] Seq=7423 Ack=97493 Win=4899 Len=0 TSval=30631 TSecr=1333905898"
"287","156.512785","147.32.83.245","209.237.199.128","TCP","66","42290  >  443 [ACK] Seq=7423 Ack=98941 Win=4944 Len=0 TSval=30631 TSecr=1333905898"
"288","156.512796","147.32.83.245","209.237.199.128","TCP","66","42290  >  443 [ACK] Seq=7423 Ack=100389 Win=4989 Len=0 TSval=30631 TSecr=1333905898"
"289","156.512809","147.32.83.245","209.237.199.128","TCP","66","42290  >  443 [ACK] Seq=7423 Ack=101837 Win=5034 Len=0 TSval=30631 TSecr=1333905898"
"290","156.512823","147.32.83.245","209.237.199.128","TCP","66","42290  >  443 [ACK] Seq=7423 Ack=103285 Win=5080 Len=0 TSval=30631 TSecr=1333905898"
"291","156.512835","147.32.83.245","209.237.199.128","TCP","66","42290  >  443 [ACK] Seq=7423 Ack=104733 Win=5125 Len=0 TSval=30631 TSecr=1333905898"
"292","156.512848","147.32.83.245","209.237.199.128","TCP","66","42290  >  443 [ACK] Seq=7423 Ack=106181 Win=5170 Len=0 TSval=30631 TSecr=1333905898"
"293","156.512858","147.32.83.245","209.237.199.128","TCP","66","42290  >  443 [ACK] Seq=7423 Ack=107553 Win=5215 Len=0 TSval=30631 TSecr=1333905898"
"294","156.520991","209.237.199.128","147.32.83.245","TLSv1.2","284","Application Data, Application Data"
"295","156.521628","147.32.83.245","209.237.199.128","TCP","66","42290  >  443 [ACK] Seq=7423 Ack=107771 Win=5215 Len=0 TSval=30633 TSecr=1333905909"
"296","156.550511","147.32.83.245","69.195.178.128","TCP","74","55966  >  443 [SYN] Seq=0 Win=65535 Len=0 MSS=1460 SACK_PERM=1 TSval=30640 TSecr=0 WS=64"
"297","156.571521","147.32.83.245","209.237.199.128","TLSv1.2","495","Application Data"
"298","156.577266","209.237.199.128","147.32.83.245","TLSv1.2","451","Application Data, Application Data"
"299","156.577774","147.32.83.245","209.237.199.128","TCP","66","42290  >  443 [ACK] Seq=7852 Ack=108156 Win=5261 Len=0 TSval=30647 TSecr=1333905965"
"300","156.621146","209.237.199.128","147.32.83.245","TCP","66","443  >  42290 [ACK] Seq=108156 Ack=7852 Win=289 Len=0 TSval=1333906009 TSecr=30646"
"301","156.623270","147.32.83.245","209.237.199.128","TLSv1.2","104","Application Data"
"302","156.631300","209.237.199.128","147.32.83.245","TCP","66","443  >  42290 [ACK] Seq=108156 Ack=7890 Win=289 Len=0 TSval=1333906019 TSecr=30659"
"303","156.631773","147.32.83.245","209.237.199.128","TLSv1.2","878","Application Data"
"304","156.639738","209.237.199.128","147.32.83.245","TCP","66","443  >  42290 [ACK] Seq=108156 Ack=8702 Win=300 Len=0 TSval=1333906027 TSecr=30661"
"305","156.657343","104.152.52.23","147.32.83.245","TCP","60","45078  >  5678 [SYN] Seq=0 Win=1024 Len=0"
"306","156.657842","147.32.83.245","104.152.52.23","TCP","54","5678  >  45078 [RST, ACK] Seq=1 Ack=1 Win=0 Len=0"
"307","156.690291","69.195.178.128","147.32.83.245","TCP","74","443  >  55966 [SYN, ACK] Seq=0 Ack=1 Win=65535 Len=0 MSS=1460 SACK_PERM=1 TSval=2397893836 TSecr=30640 WS=256"
"308","156.691296","147.32.83.245","69.195.178.128","TCP","66","55966  >  443 [ACK] Seq=1 Ack=1 Win=87616 Len=0 TSval=30675 TSecr=2397893836"
"309","156.695555","147.32.83.245","69.195.178.128","TLSv1.2","583","Client Hello"
"310","156.761997","209.237.199.128","147.32.83.245","TLSv1.2","273","Application Data, Application Data"
"311","156.762452","147.32.83.245","209.237.199.128","TCP","66","42290  >  443 [ACK] Seq=8702 Ack=108363 Win=5261 Len=0 TSval=30693 TSecr=1333906150"
"312","156.782101","209.237.199.128","147.32.83.245","TLSv1.2","515","Application Data, Application Data"
"313","156.782540","147.32.83.245","209.237.199.128","TCP","66","42290  >  443 [ACK] Seq=8702 Ack=108812 Win=5261 Len=0 TSval=30698 TSecr=1333906170"
"314","156.835213","69.195.178.128","147.32.83.245","TCP","66","443  >  55966 [ACK] Seq=1 Ack=518 Win=66816 Len=0 TSval=2397893981 TSecr=30677"
"315","156.838542","69.195.178.128","147.32.83.245","TLSv1.2","2962","Server Hello"
"316","156.838567","69.195.178.128","147.32.83.245","TLSv1.2","473","Certificate, Server Key Exchange, Server Hello Done"
"317","156.840244","147.32.83.245","69.195.178.128","TCP","66","55966  >  443 [ACK] Seq=518 Ack=1449 Win=90496 Len=0 TSval=30713 TSecr=2397893985"
